content,content
"""Academics are still waiting to receive key data originally promised in 2018 from Facebook, which has declined to provide some of the data citing privacy fears,Chrome team's idea for a new, but still cookie-based, anti-tracking standard is technically disingenuous and aimed at protecting Google's business interests,Court filing: AT&T and FTC reached a settlement agreement in a 2014 mobile data throttling lawsuit, which still needs to be reviewed and voted on by FTC,Carriers' agreement with state AGs to implement new robocall blocking tech does not impose any legally binding terms on them and there is no deadline to comply,A graphic look at a columnist's web activity during a typical workday shows how websites and tech firms track users via tracking scripts, unique IDs, and more,Profile of Carla Engelbrecht, the director of product innovation at Netflix, whose experiments with interactive kids programs were a precursor to Bandersnatch,Profile of Rodney Brooks, the Australian roboticist who in 1990 co-founded iRobot, which used to make robots for US army and is now popular for Roomba vacuums,Trump's tweets “ordering” US companies to start looking for an alternative to China rattle tech stocks, with Apple closing down 4.6%, Amazon 3.1%, and AMD 7.4%,A look at the changing landscape of seed funding as more big VCs compete there, and pros and cons of raising a seed round led by a big VC vs a seed-focused fund,Misinformation, spread by exploiting our eagerness to share content without thinking, has created a “new world disorder” that we need to safeguard against,Imposters are making as much as $10K in royalties at a time by uploading copyright-infringing content to streaming services like Spotify and Apple Music,Google Photos can now search for text that appears in user images with its optical character recognition filter,Source: Xiaomi scans phones to track lifestyle changes like a divorce or a promotion for credit scores in Indonesia; Xiaomi to launch lending service in India,Riot Games has settled for an undisclosed sum a class action lawsuit alleging gender discrimination, sexual harassment, and retaliation for speaking out,A first look at the Disney+ app that Disney says will offer a heavily curated and personalized experience for users with a combination of human editors and AI,Bitcoin wallet provider Blockchain announces a partnership with BitPay to integrate BitPay's payment architecture into its wallet service,Netflix says it is testing “Collections” on iOS that are curated by experts on the company's creative teams based on factors like genre, tone, and story line,Seven top US publishers sue Audible, aiming to block the planned rollout of Captions, a new feature that shows text on screen as a book is narrated,Appeals court stays an earlier ruling in FTC's suit against Qualcomm that would have required Qualcomm to renegotiate all of its existing chip and patent deals,Educational robotic toymaker Sphero acquires littleBits, a maker of electronics building kits and instructional resources for kids,Sources: Uber's $1 Safe Rides Fee, introduced in 2014, was devised primarily to add $1 of pure margin to each trip; court documents: the fee brought in ~$500M,Investigation finds 4,152 items on Amazon that were declared unsafe by federal agencies, are deceptively labeled, or are banned by regulators,Google releases new community guidelines for employees, placing new restrictions on talking about politics on internal mailing lists and forums""",1
"""The chemistry behind how you make a record-breaking giant soap bubble,YouTube has removed 210 channels that posted about the Hong Kong protests,Quantum radar has been demonstrated for the first time	""",1
"""Special issue: longevity,A doctor and medical ethicist argues life after 75 is not worth living,Ezekiel Emanuel questions “whether our consumption is worth our contribution” in old age.,Humans and Technology,Aug 24,The chemistry behind how you make a record-breaking giant soap bubble,Read more,Silicon Valley,Aug 23,YouTube has removed 210 channels that posted about the Hong Kong protests,It’s unclear which rules the channels had broken, though, or even which ones have been taken down.,...,The news:, YouTube has disabled 210 channels, ,writing in a blog post, they had “behaved in a coordinated manner while uploading videos related to the ongoing protests in Hong Kong.”,The reasoning:, YouTube said its action “was consistent with recent observations and actions related to China announced by Facebook and Twitter.” The two companies ,announced earlier this week, that they’d suspended nearly 1,000 accounts thought to be part of a Chinese government operation to spread disinformation about the protests in Hong Kong. YouTube said it had detected the use of VPNs and other methods to disguise the origin of the accounts, as well as other activity usually associated with “coordinated influence operations.”,Vague details:, In many ways, YouTube’s post raises more questions than it answers. Are these accounts being closed because they’re posting disinformation? Or because they are coordinating with each other? The post didn’t provide any examples of accounts that have been removed, or the sort of videos they were posting. There’s a risk that the company could appear to be selectively applying (unspecified) rules.,Double standards:, YouTube’s decision raises another, obvious question: If it can remove these accounts so quickly, why can’t it do more to stop the far right and white extremists from using its platform to spread ,radicalizing views,, or to crack down on conspiracy-theory accounts? ,Sign up ,here, for our daily newsletter The Download to get your dose of the latest must-read news from the world of emerging tech.,Share,Link,Author,Charlotte Jee,Expand,Computing,Aug 23,Quantum radar has been demonstrated for the first time,CRISPR,The next trick for CRISPR is gene-editing pain away,A family of street performers could walk on coals. Here’s how the secret of why they felt no pain could benefit others.,01.,Disgraced CRISPR scientist had plans to start a designer-baby business,July 2019,02.,The search for the kryptonite that can stop CRISPR,May 2019,03.,A CRISPR startup is testing pig organs in monkeys to see if they’re safe for us,June 2019,Special issue: longevity,A doctor and medical ethicist argues life after 75 is not worth living,Ezekiel Emanuel questions “whether our consumption is worth our contribution” in old age.,Humans and Technology,Aug 24,The chemistry behind how you make a record-breaking giant soap bubble,Read more,The chemistry behind how you make a record-breaking giant soap bubble,Silicon Valley,Aug 23,YouTube has removed 210 channels that posted about the Hong Kong protests,It’s unclear which rules the channels had broken, though, or even which ones have been taken down.,...,The news:, YouTube has disabled 210 channels, ,writing in a blog post, they had “behaved in a coordinated manner while uploading videos related to the ongoing protests in Hong Kong.”,The reasoning:, YouTube said its action “was consistent with recent observations and actions related to China announced by Facebook and Twitter.” The two companies ,announced earlier this week, that they’d suspended nearly 1,000 accounts thought to be part of a Chinese government operation to spread disinformation about the protests in Hong Kong. YouTube said it had detected the use of VPNs and other methods to disguise the origin of the accounts, as well as other activity usually associated with “coordinated influence operations.”,Vague details:, In many ways, YouTube’s post raises more questions than it answers. Are these accounts being closed because they’re posting disinformation? Or because they are coordinating with each other? The post didn’t provide any examples of accounts that have been removed, or the sort of videos they were posting. There’s a risk that the company could appear to be selectively applying (unspecified) rules.,Double standards:, YouTube’s decision raises another, obvious question: If it can remove these accounts so quickly, why can’t it do more to stop the far right and white extremists from using its platform to spread ,radicalizing views,, or to crack down on conspiracy-theory accounts? ,Sign up ,here, for our daily newsletter The Download to get your dose of the latest must-read news from the world of emerging tech.,Share,Link,Author,Charlotte Jee,Expand,YouTube has removed 210 channels that posted about the Hong Kong protests,Computing,Aug 23,Quantum radar has been demonstrated for the first time,Quantum radar has been demonstrated for the first time,CRISPR,The next trick for CRISPR is gene-editing pain away,A family of street performers could walk on coals. Here’s how the secret of why they felt no pain could benefit others.,01.,Disgraced CRISPR scientist had plans to start a designer-baby business,July 2019,02.,The search for the kryptonite that can stop CRISPR,May 2019,03.,A CRISPR startup is testing pig organs in monkeys to see if they’re safe for us,June 2019	""",1
"""Rachio 3: A Smart Yard Sprinkler Controlling Water Consumption,5G is Coming — Here’s How Entrepreneurs Can Leverage It,Optimize Micro-Interactions to Enhance your UX Design,Bitcoin Pizza and Our Decentralized Future,How Companies Can Leverage Data Protection to Restore Trust in IoT,6 Strategies for MBA Students to Minimize Distractions and Achieve Goals,Elements to Help You Develop Emotional Intelligence,What Banks Need to Know to Strengthen Their Social Strategies,Is Business Intelligence the Fastest Way to Improve Customer Experience?,Artificial Intelligence: A Tool or a Threat to Cybersecurity?,3 Ways to Create Cross-Functional Data Science Teams,Virtual Reality Can Save Lives and Isn’t Only for Fun,Resisting and Reducing Enterprise Storage Downtime,3 Ways Tech Is Responsible for Crucial Healthcare Improvements,The Evolution of Startups in India — The Story Up Until Now,Small Business Marketing Strategies that Will Work for You,7 Rules for Creating a Healthy Working Space in the Office,Crowdfunding Your Startup at 700 Percent Oversubscribed,10 Crypto Gurus You Have to Follow,10 Reasons that Demonstrate the Importance of Technology in Busines""",1
"""Weaponize your drone and face a $25,000 fine from the FAA,The Walking Dead: Onslaught interview: Learning about the campaign, co-op, and more,Red Matter’s Oculus Quest sales eclipse its Rift sales in just 1 week,Actually, engineers are the perfect tech CEOs,You can find Wi-Fi 6 routers on shelves today, but do you need one?,Huawei’s big move from component maker to AI service provider,How Machine Games took a single-player series into co-op with Wolfenstein: Youngblood,Nintendo continues to dominate TV ahead of triple-A season,Oculus’ VP Jason Rubin isn’t fretting over Sony’s acquisition of Insomniac,Persona franchise surpasses 10 million copies sold,AI Weekly: Detroit’s facial recognition battle is about the ends justifying the means,The RetroBeat: World of Illusion is a Genesis co-op treasure,Quasi-AR baby steps are preparing us for true AR’s digital future,Wolves in the Walls wins first Emmy Award for a virtual being,Weaponize your drone and face a $25,000 fine from the FAA,Riot Games closes a chapter with sexual harassment lawsuit settlement,Waymo cars refuse to drive in unsafe conditions,Leiting Games launches dungeon-crawler Overdungeon on Steam,ProBeat: YouTube messages should have never existed,Qualcomm wins pause in FTC antitrust enforcement pending appeal,LG Dual Screen review: A foldable enigma,Jam City unveils Frozen Adventures mobile game coming in November,The DeanBeat: How Germany does gaming events right with Gamescom,If Apple Watch adopts Apple Card’s poor titanium coating, look out,Gears Pop is Clash Royale with cover mechanics,Huawei details AI chips for training and inference,Sphero acquires modular electronics company LittleBits,iDevices’ Instinct is a light switch with Alexa built in,Microsoft widens its efforts to support DirectX 12 games on Windows 7,Fortnite team nerfs B.R.U.T.E. mech to bring back more variety,YouTube disables 210 channels tied to Hong Kong disinformation campaigns,Baby Rage unveils plans for crossplay VR-PC shooter game Extreme Tactical Executioners,HP CEO Dion Weisler steps down, taps veteran insider Enrique Lores,STALICLA Announces Completion of pre-IND Meeting With FDA on STP1 for Subgroup of Pat...,VMware acquires Pivotal and Carbon Black for nearly $5 billion,Minecraft Earth beta expands to Android,Black Desert brings its MMO action to PS4,Apple Watch patent application reveals millimeter wave 5G and Wi-Fi design,Oculus mobile VR leader leaves Facebook,Carnegie Mellon and Oregon State team wins first leg of DARPA Subterranean Challenge robot competition,Hearthstone nerfs Dr. Boom, Conjurer’s Calling, Luna’s Pocket Galaxy, Extra Arms … and Barnes	""",1
"""How China used Facebook, Twitter, and YouTube to spread disinformation about the Hong Kong protests,Google says it’s making Chrome more private, but advertisers will still track you,Listen to our new podcast with never-before-told stories about Amazon’s ascent,Amazon’s tiny profits, explained,DoorDash is still pocketing workers’ tips, almost a month after it promised to stop  ,Bernie Sanders wants to ban police use of facial recognition tech,The US government’s battle with Chinese telecom giant Huawei, explained,How the Hong Kong protests created the #BoycottMulan campaign,What does it even mean to be a tech company in 2019?,The algorithms that detect hate speech online are biased against black people,Google employees are demanding an end to the company’s work with agencies like CBP and ICE,How WeWork is trying to justify its tech company valuation,After the El Paso and Gilroy shootings, tech leaders are saying platforms must stop amplifying hate speech,The CBS and Viacom merger, explained,Buying Ring surveillance cameras saves Amazon money on stolen packages,Jeff Bezos is quietly letting his charities do something radical — whatever they want,Trump’s executive order on social media bias is a distraction,The drama over Mitch McConnell’s Twitter account, explained,How facial recognition became the most feared technology in the US  ,Uber lost an eye-popping $5 billion in a single quarter,Facebook is starting to sell streaming video subscriptions — but not from HBO or Showtime,Why Amazon pays warehouse employees to tweet about their jobs,Trump says Google is biased against conservatives. Here’s how search actually works.,Is Big Tech addictive? A debate with Nir Eyal.  ,America has a terrible digital divide. Elizabeth Warren has a plan for that too.  ,The wrong US response to Russia and China may trigger a “new Cold War,” warns Stanford University’s Larry Diamond,Trump wants social media to detect mass shooters before they commit crimes,8chan, a nexus of radicalization, explained,Rep. Lauren Underwood says supporting impeachment would “look like a power grab” to her swing district,Here’s how Facebook, YouTube, Twitter, and 8chan handle white supremacist content,“Keep that shit on the battlefield”: Beto O’Rourke calls for major gun reform following El Paso and Dayton shootings,Political tension at Google is only getting worse,#KamalaHarrisDestroyed debate shows how little we understand social media manipulation,“The $300 textbook is dead,” says the CEO of textbook maker Pearson,Josh Hawley’s bill to limit your Twitter time to 30 minutes a day, explained,Cambridge Analytica made “ethical mistakes” because it was too focused on regulation, former COO says,Microsoft, Dell, Concur: Here are all the tech companies doing business with ICE and how much they’re getting paid,A former Amazon employee hacked the credit card data of 100 million Americans,Why Google employees are donating to Warren and Sanders — candidates who want to break up Google ,Megan Rapinoe still isn’t going to the White House, even if Trump invites her""",1
"""How Uber Got Lost,Google Tries to Corral Its Staff After Ugly Internal Debates,Facebook Bans Ads From The Epoch Times,Qualcomm Wins Reprieve in F.T.C. Antitrust Case With Appeals Court Ruling,As Amazon Fires Spread, So Do the Misleading Photos,The Week in Tech: Facebook’s First Step Toward Treating Our Data Better,Snapchat’s Disappearing Act Leaves Venice Beach Searching for Its Future,YouTube Disables 210 Channels That Spread Disinformation About Hong Kong Protests,Soap, Detergent and Even Laxatives Could Turbocharge a Battery Alternative,Alibaba Postpones Hong Kong Listing as Protests Roil Markets,Inside India’s Messy Electric Vehicle Revolution,How a Conservative News Site Thrived on Facebook and Google,Instagram’s Chain-Letter Uprising,YouTuber’s Surprise Discovery Gives Parents Last Look at Son They Lost""",1
"""Will the first Modi 2.0 budget boost India’s AI readiness?,Is Google really helping to fuel Beijing’s military AI ambitions?,Startup developing killer swarm drones for Indian Air Force,China’s VC funding party is over""",1
"""“Telling Lies” threads a story around a government employee who gets paid to deceive others.,Despite internal policies to protect customers, the ecommerce giant listed thousands of items deemed unsafe by federal agencies, deceptively labeled or banned by regulators, according to a Wall Street Journal report.,YouTubers have to build businesses off their viral fame quicker than ever, and it's changing YouTube's content.,business,technology, ,Success!, Check your inbox for details. , You might also like:, ,Please enter a valid email address,You might also like..., ,See all newsletters, ,The company issued new guidelines in response to “a year of increased incivility on our internal platforms.”,The conservative news outlet shifted its spending on Facebook in a way that blurred its links to $2 million worth of ads promoting Trump.,The former Los Angeles Laker has been one of the most prominent figures in the mainstreaming of competitive video gaming but has been in a bitter internal battle over the future of his esports franchise.,Google announced Thursday it had taken down 210 channels on YouTube after discovering they ""behaved in a coordinated manner while uploading videos"" related to the protests in Hong Kong, an effort that the tech giant linked to recent, Chinese-backed operations on Facebook and Twitter.,An Apple Card support page warns if the titanium credit card comes into contact with leather or denim, the interaction could cause “permanent discoloration that might not wash off.”,Twelve of the country's largest telephone companies on Thursday pledged to implement new technology that would spot and block robocalls while helping law enforcement officials track down criminals, part of an agreement brokered between the industry and 51 attorneys general.,A Japanese temple has settled on a new plan for connecting with the masses, one that channels ancient wisdom through the technology of the future.,An android robotic priest was unveiled at Kodaiji temple, a 400-year-old Buddhist temple in Kyoto, Japan.,“In general, our misinformation efforts are focused on keeping our elections safe,” says an Instagram spokeswoman.,The ramifications of Instagram’s supposed new “rule where they can use your photos” weren’t totally clear.,Neither Republicans nor civil rights groups are happy.,Amazon woos members of Congress to its warehouses even as President Trump and his would-be Democratic rivals rip the retailer for its treatment of the people who work there.,In a complaint filed in New York court, Walmart alleged Tesla solar panels had caught fire at least seven times dating back to 2012.,China pushed back against claims by Twitter and Facebook that the government had run disinformation operations aimed at the Hong Kong protests. The comments underscored the challenging of setting global standards for online speech.,L.A. County is about to challenge the voting machine industry,Facebook has faced repeated criticism from conservatives that it is biased against them. It released an interim report Tuesday with its first findings on the topic.,The U.S. government is forging ahead with its review of online platforms for potential competition concerns, coordinating with state attorneys general and signaling it could soon send document demands to Silicon Valley and its critics.,business,technology,Success!, Check your inbox for details., Please enter a valid email address ,You might also like: ,See all newsletter""",1
